<?xml version="1.0"?>
<GmProject Name="2 Partitions, one with 2 cals, one with 1 cal" xmlns:xsi="http://www.w3.org/2001/XMLSchema-instance" xsi:noNamespaceSchemaLocation="GmHeader.xsd">
	<HeaderVersion>1.00</HeaderVersion>
	<SignedHeaderInfo>
		<!-- SignerInfoDummyKey.hex uses Vector Demo/Dummy Key and Dummy Subject name "Engine" -->
		<image>SignerInfoDummyKey.hex</image>
		<!-- ECU ID 0 is a module meant for all ECUs (no restriction to single unique) -->
		<EcuId>00000000000000000000000000000000</EcuId>
		<!-- Demo/Dummy Ecu name -->
		<EcuName>DemoFbl1</EcuName>
	</SignedHeaderInfo>
	<AppHeaderInfo name="DemoAppl">
		<HeaderAddress>0x0007C000</HeaderAddress>
		<!--  Do not use leading zeros here  -->
		<ModuleId>1</ModuleId>
		<!-- Bootloader Compatibility ID, always 0x8000 for first release -->
		<BCID>0x8000</BCID>
		<!-- Not before ID, always starts with 0 for first release. Do not use leading zeros here  -->
		<NBID>0</NBID>
		<!-- Design Level suffix, always starts with AA for first release -->
		<DLS>AA</DLS>
		<!-- Demo/Dummy part number, can be started with, replace with required number at some point -->
		<PartNumber>0x11111111</PartNumber>
		<!-- Optional Ascii part number - Remove comment and edit if desired to use -->
		<!-- <AsciiPartNumber>11111111</AsciiPartNumber> -->
		<!-- Number of Partitions == 0 if no cal modules are used. Need to be consistent to defined "Partition" element number that follows -->
		<Partitions NumberOfPartitions="2">
			<!-- Number of Regions larger or equal 1, need to be consistent to defined "Region" element number that follows -->
			<Partition NumberOfRegions="1">
				<!-- Regions have to be in order (start with lowest address)! -->
				<Region start="0x140000" length="0x4000"/>
				<CalFiles NumberOfCalFiles="2">
					<!-- Image BaseAddress need to be within -->
					<Image BaseAddress="0x140000">cal1_plain.gbf</Image>
					<Image BaseAddress="0x140800">cal2_plain.gbf</Image>
				</CalFiles>
			</Partition>
			<!-- Number of Regions larger or equal 1, need to be consistent to defined "Region" element number that follows -->
			<Partition NumberOfRegions="1">
				<!-- Regions have to be in order (start with lowest address)! -->
				<Region start="0x160000" length="0x4000"/>
				<CalFiles NumberOfCalFiles="1">
				<Image BaseAddress="0x160000">cal3_plain.gbf</Image>
				</CalFiles>
			</Partition>
		</Partitions>
	</AppHeaderInfo>
	<!-- Add a CalHeaderInfo structure per required cal (non if not required) -->
	<CalHeaderInfo Name="cal1">
		<ModuleId>2</ModuleId>
		<!-- Calibration Compatibility ID, always 0x8000 for first release -->
		<CCID>0x8000</CCID>
		<!-- Design Level suffix, always starts with AA for first release -->
		<DLS>AA</DLS>
		<!-- Demo/Dummy part number, can be started with, replace with required number at some point -->
		<PartNumber>0x22222222</PartNumber>
		<!-- Optional Ascii part number - Remove comment and edit if desired to use -->
		<!-- <AsciiPartNumber>22222222</AsciiPartNumber> --> 
	</CalHeaderInfo>
	<CalHeaderInfo Name="cal2">
		<ModuleId>3</ModuleId>
		<!-- Calibration Compatibility ID, always 0x8000 for first release -->
		<CCID>0x8000</CCID>
		<!-- Design Level suffix, always starts with AA for first release -->
		<DLS>AA</DLS>
		<!-- Demo/Dummy part number, can be started with, replace with required number at some point -->
		<PartNumber>22334455</PartNumber>
		<!-- Optional Ascii part number - Remove comment and edit if desired to use -->
		<!-- <AsciiPartNumber>0154CBF7</AsciiPartNumber> -->
	</CalHeaderInfo>
	<CalHeaderInfo Name="cal3">
		<ModuleId>4</ModuleId>
		<!-- Calibration Compatibility ID, always 0x8000 for first release -->
		<CCID>0x8000</CCID>
		<!-- Design Level suffix, always starts with AA for first release -->
		<DLS>AA</DLS>
		<!-- Demo/Dummy part number, can be started with, replace with required number at some point -->
		<PartNumber>0x44444444</PartNumber>
		<!-- Optional Ascii part number - Remove comment and edit if desired to use -->
		<!-- <AsciiPartNumber>44444444</AsciiPartNumber> -->
	</CalHeaderInfo>
</GmProject>
